{
  "version": 1,
  "repo": ".",
  "tickets": "./tickets.json",
  "ticket_status": true,
  "agent": "codex",
  "verification": [
    [
      "python3",
      "-m",
      "unittest",
      "discover",
      "-s",
      "tests",
      "-v"
    ]
  ],
  "adaptive": {
    "mode": "shadow",
    "profiles": {
      "standard": {
        "agent": "codex",
        "model": "gpt-5.6-terra",
        "effort": "medium",
        "rank": 1
      },
      "demanding": {
        "agent": "codex",
        "model": "gpt-6-astra",
        "effort": "high",
        "rank": 2
      }
    },
    "defaults": {
      "codex": "standard"
    },
    "review_profile": "demanding",
    "max_attempts": 1,
    "max_invocations": 20
  }
}
