{
  "version": 1,
  "repo": "../../anvil-demo",
  "tickets": "serial-tickets.json",
  "verification": [
    ["python3", "-m", "unittest", "discover", "-s", "tests", "-v"]
  ],
  "agent_timeout": 900,
  "check_timeout": 300,
  "credential_exclusion": [
    "AWS_SECRET_ACCESS_KEY",
    "AWS_SESSION_TOKEN",
    "GITHUB_TOKEN",
    "NPM_TOKEN",
    "STRIPE_SECRET_KEY"
  ]
}
