{
  "version": 1,
  "repo": "../../anvil-demo",
  "tickets": "parallel-tickets.json",
  "workers": [
    {"id": "codex-builder", "agent": "codex"},
    {"id": "claude-builder", "agent": "claude-code"}
  ],
  "agent": "codex",
  "max_processes": 2,
  "verification": [
    ["python3", "-m", "unittest", "discover", "-s", "tests", "-v"]
  ],
  "agent_timeout": 900,
  "check_timeout": 300
}
